Role,Cluster,MicroAgent,Purpose,Inputs,Outputs,Triggers,Tools,KPIs
Orchestration & Governance,Project Coordination,Project Coordinator,"Orchestrate project activities and maintain project timeline","Project plans, milestone updates, resource requests, stakeholder communications","Project status reports, timeline updates, resource allocations, stakeholder notifications","Project milestones, schedule changes, resource conflicts, stakeholder requests","Project management software, communication platforms, scheduling tools","On-time delivery rate, stakeholder satisfaction, resource utilization efficiency"
Orchestration & Governance,Project Coordination,Stakeholder Manager,"Manage stakeholder relationships and communications","Stakeholder lists, communication requirements, project updates, feedback requests","Stakeholder communications, feedback summaries, relationship status reports","Project updates, stakeholder requests, milestone achievements, issue escalations","CRM systems, communication platforms, feedback collection tools","Stakeholder engagement rate, communication response time, stakeholder satisfaction score"
Orchestration & Governance,Governance & Compliance,Compliance Monitor,"Ensure all activities comply with regulatory and organizational standards","Compliance requirements, project artifacts, audit requests, regulatory updates","Compliance reports, risk assessments, remediation plans, audit documentation","Compliance checkpoints, regulatory changes, audit requests, risk identification","Compliance management systems, audit tools, risk assessment frameworks","Compliance score, audit success rate, risk mitigation effectiveness"
Orchestration & Governance,Governance & Compliance,Quality Assurance Controller,"Maintain quality standards across all deliverables","Quality standards, deliverables, review requests, quality metrics","Quality reports, improvement recommendations, certification status","Deliverable submissions, quality checkpoints, standard updates","Quality management systems, review platforms, metrics dashboards","Quality score, defect rate, improvement implementation rate"
Orchestration & Governance,Resource Management,Resource Allocator,"Optimize resource allocation across projects and activities","Resource requests, availability data, project priorities, capacity information","Resource assignments, capacity reports, utilization forecasts","Resource requests, capacity changes, project priority shifts","Resource management systems, capacity planning tools, analytics platforms","Resource utilization rate, allocation efficiency, cost optimization"
Sales & Discovery,Lead Generation,Market Intelligence Gatherer,"Identify and qualify potential AI consulting opportunities","Market data, industry reports, company profiles, technology trends","Lead lists, market analysis, opportunity assessments, competitive intelligence","Market changes, new technology releases, industry events, competitive moves","Market research platforms, web scraping tools, industry databases, social listening tools","Lead generation rate, lead quality score, market coverage percentage"
Sales & Discovery,Lead Generation,Opportunity Scorer,"Score and prioritize leads based on fit and potential value","Lead information, scoring criteria, market data, historical performance","Scored lead rankings, priority recommendations, fit assessments","New leads, scoring criteria updates, market condition changes","Scoring algorithms, CRM systems, analytics platforms, predictive models","Scoring accuracy, conversion prediction rate, priority alignment score"
Sales & Discovery,Qualification & Discovery,Discovery Interviewer,"Conduct structured discovery sessions with prospects","Prospect information, discovery frameworks, interview guides, previous interactions","Discovery reports, needs assessments, solution recommendations, next steps","Qualified leads, discovery requests, follow-up schedules","Interview platforms, documentation systems, analysis tools, CRM integration","Discovery completion rate, needs identification accuracy, solution fit score"
Sales & Discovery,Qualification & Discovery,Requirements Analyzer,"Analyze and structure client requirements from discovery sessions","Discovery notes, client documents, requirement specifications, business objectives","Structured requirements, gap analysis, feasibility assessments, scope definitions","Discovery completion, requirement changes, scope discussions","Requirements management tools, analysis frameworks, documentation platforms","Requirements clarity score, gap identification rate, scope accuracy"
Sales & Discovery,Proposal Development,Solution Designer,"Design AI solutions based on client requirements","Requirements specifications, technical constraints, business objectives, resource availability","Solution architectures, implementation plans, technical specifications, resource estimates","Approved requirements, design requests, solution iterations","Design tools, architecture frameworks, modeling software, estimation tools","Solution acceptance rate, design quality score, estimate accuracy"
Sales & Discovery,Proposal Development,Proposal Writer,"Create comprehensive proposals for AI consulting engagements","Solution designs, pricing models, client requirements, competitive information","Formal proposals, executive summaries, pricing sheets, presentation materials","Solution approval, proposal requests, competitive situations","Proposal platforms, document management systems, pricing tools, presentation software","Proposal win rate, response time, client feedback score"
Data Intake & Mapping,Data Ingestion,Data Connector,"Establish connections to various data sources and extract data","Data source credentials, connection parameters, extraction schedules, data requirements","Raw data streams, connection status, extraction logs, data samples","New data sources, extraction schedules, connection failures, data requests","ETL platforms, API connectors, database clients, cloud integration services","Connection success rate, data extraction volume, extraction reliability"
Data Intake & Mapping,Data Ingestion,Data Validator,"Validate incoming data for completeness and initial quality checks","Raw data streams, validation rules, data schemas, quality thresholds","Validated data, quality reports, error logs, rejection notifications","Data arrival, validation rules updates, quality threshold breaches","Data validation frameworks, quality assessment tools, monitoring dashboards","Data quality score, validation accuracy, error detection rate"
Data Intake & Mapping,Data Cataloging,Metadata Extractor,"Extract and catalog metadata from ingested data sources","Data sources, metadata standards, cataloging rules, schema definitions","Metadata catalogs, data dictionaries, schema documentation, lineage information","New data sources, schema changes, cataloging requests","Metadata management tools, data cataloging platforms, schema discovery tools","Metadata coverage, catalog completeness, documentation accuracy"
Data Intake & Mapping,Data Cataloging,Data Classifier,"Classify data based on type, sensitivity, and business value","Data samples, classification rules, sensitivity guidelines, business context","Data classifications, sensitivity labels, value assessments, access recommendations","New data, classification rule updates, sensitivity reviews","Data classification tools, machine learning models, business glossaries","Classification accuracy, coverage percentage, sensitivity identification rate"
Data Intake & Mapping,Data Quality Assessment,Quality Profiler,"Profile data to assess quality dimensions and identify issues","Data sets, profiling rules, quality dimensions, business rules","Data profiles, quality metrics, issue reports, improvement recommendations","Data updates, profiling schedules, quality reviews","Data profiling tools, statistical analysis software, quality frameworks","Quality assessment coverage, issue identification rate, profile accuracy"
Data Intake & Mapping,Data Quality Assessment,Data Lineage Tracker,"Track data lineage and transformations across the data pipeline","Data flows, transformation rules, processing logs, system configurations","Lineage diagrams, impact analysis, dependency maps, change tracking","Data transformations, system changes, lineage requests","Lineage tracking tools, data flow analyzers, impact assessment platforms","Lineage coverage, tracking accuracy, dependency identification rate"
Workflow Design,Requirements Analysis,Business Analyst,"Analyze business requirements and translate them into technical specifications","Business requirements, stakeholder input, process documentation, success criteria","Technical specifications, requirement traceability, acceptance criteria, design constraints","Requirement submissions, specification requests, requirement changes","Requirements analysis tools, business process modeling software, traceability matrices","Requirements coverage, specification accuracy, stakeholder acceptance rate"
Workflow Design,Requirements Analysis,Use Case Designer,"Design detailed use cases for AI implementation scenarios","Business requirements, user personas, process flows, system capabilities","Use case specifications, user stories, scenario descriptions, interaction models","Requirements approval, use case requests, scenario updates","Use case modeling tools, user story platforms, process design software","Use case coverage, scenario completeness, user acceptance rate"
Workflow Design,Solution Architecture,AI Architect,"Design AI solution architectures that meet business requirements","Technical specifications, AI capabilities, infrastructure constraints, performance requirements","Solution architectures, component designs, integration patterns, deployment models","Approved specifications, architecture requests, design reviews","Architecture design tools, AI frameworks, cloud platforms, modeling software","Architecture approval rate, design quality score, implementation feasibility"
Workflow Design,Solution Architecture,Integration Designer,"Design integration patterns between AI components and existing systems","System inventories, integration requirements, data flows, security constraints","Integration architectures, API specifications, data flow diagrams, security models","Architecture approval, integration requirements, system changes","Integration platforms, API design tools, security frameworks, data modeling tools","Integration success rate, API adoption rate, security compliance score"
Workflow Design,Workflow Optimization,Process Optimizer,"Optimize AI workflows for efficiency and performance","Current workflows, performance metrics, optimization criteria, resource constraints","Optimized workflows, performance improvements, resource savings, implementation plans","Performance issues, optimization requests, resource constraints","Process mining tools, optimization algorithms, performance analyzers, simulation software","Performance improvement percentage, resource optimization rate, efficiency gains"
Workflow Design,Workflow Optimization,Automation Designer,"Design automation workflows to reduce manual intervention","Manual processes, automation opportunities, tool capabilities, business rules","Automation workflows, process automation, rule engines, monitoring systems","Automation requests, process inefficiencies, rule changes","Workflow automation platforms, RPA tools, business rule engines, monitoring systems","Automation coverage, manual effort reduction, process reliability"
Implementation,Development,AI Developer,"Develop AI models and algorithms according to specifications","Technical specifications, training data, model requirements, performance criteria","Trained models, algorithms, code libraries, documentation, test results","Development requests, specification changes, model updates","ML frameworks, development environments, model training platforms, version control","Model accuracy, development velocity, code quality score"
Implementation,Development,Code Reviewer,"Review code quality, security, and adherence to standards","Source code, coding standards, security guidelines, review checklists","Review reports, approval status, improvement recommendations, security assessments","Code submissions, review requests, standard updates","Code review platforms, static analysis tools, security scanners, quality gates","Review coverage, defect detection rate, security vulnerability identification"
Implementation,Integration,System Integrator,"Integrate AI components with existing systems and infrastructure","Integration specifications, system APIs, configuration requirements, deployment targets","Integrated systems, configuration files, integration tests, deployment packages","Integration requests, system changes, deployment schedules","Integration platforms, API gateways, configuration management, deployment tools","Integration success rate, deployment reliability, system compatibility"
Implementation,Integration,API Manager,"Manage APIs and service interfaces for AI components","API specifications, service requirements, security policies, usage patterns","API implementations, service documentation, security configurations, usage analytics","API requests, specification changes, security updates","API management platforms, documentation tools, security frameworks, analytics dashboards","API adoption rate, response time, security compliance, documentation completeness"
Implementation,Deployment,Deployment Manager,"Manage deployment processes and environment configuration","Deployment packages, environment specifications, deployment schedules, rollback procedures","Deployed systems, environment configurations, deployment reports, rollback plans","Deployment requests, environment changes, rollback needs","Deployment automation, environment management, monitoring tools, rollback systems","Deployment success rate, deployment time, rollback frequency, environment stability"
Implementation,Deployment,Configuration Controller,"Manage system configurations across different environments","Configuration templates, environment parameters, security settings, compliance requirements","Environment configurations, configuration drift reports, compliance status, change logs","Configuration changes, environment updates, compliance reviews","Configuration management systems, infrastructure as code, compliance scanners","Configuration accuracy, drift detection rate, compliance score, change success rate"
Validation,Testing,Test Coordinator,"Coordinate and orchestrate testing activities across different test types","Test plans, testing schedules, resource requirements, quality gates","Test execution reports, quality metrics, issue summaries, sign-off recommendations","Test requests, milestone achievements, quality gate evaluations","Test management platforms, orchestration tools, reporting dashboards, quality frameworks","Test coverage, execution efficiency, issue detection rate, quality gate success rate"
Validation,Testing,Automated Tester,"Execute automated tests for AI models and system functionality","Test scripts, test data, testing environments, expected results","Test results, defect reports, performance metrics, regression analysis","Code changes, deployment events, scheduled test runs","Test automation frameworks, CI/CD pipelines, test data management, result analyzers","Test automation coverage, execution success rate, defect detection efficiency"
Validation,Performance Validation,Performance Tester,"Validate system performance under various load conditions","Performance requirements, load scenarios, system configurations, baseline metrics","Performance reports, bottleneck analysis, scalability assessments, optimization recommendations","Performance testing requests, system changes, load increases","Load testing tools, performance monitors, analytics platforms, profiling tools","Performance compliance rate, response time improvements, resource utilization efficiency"
Validation,Performance Validation,Model Validator,"Validate AI model accuracy, bias, and fairness","Trained models, validation datasets, fairness criteria, accuracy thresholds","Model validation reports, bias assessments, fairness metrics, certification status","Model updates, validation requests, fairness reviews","Model validation frameworks, bias detection tools, fairness analyzers, statistical tools","Model accuracy score, bias detection rate, fairness compliance, validation coverage"
Validation,User Acceptance,UAT Coordinator,"Coordinate user acceptance testing with business stakeholders","UAT plans, user scenarios, acceptance criteria, stakeholder availability","UAT schedules, test results, user feedback, acceptance sign-offs","UAT requests, milestone achievements, stakeholder availability","UAT platforms, scheduling tools, feedback collection, sign-off systems","UAT completion rate, user satisfaction score, acceptance rate, feedback response rate"
Validation,User Acceptance,Feedback Analyzer,"Analyze user feedback and translate into actionable improvements","User feedback, testing results, usability data, business impact metrics","Feedback analysis, improvement recommendations, priority rankings, implementation plans","Feedback collection, analysis requests, improvement initiatives","Feedback analysis tools, sentiment analysis, prioritization frameworks, planning tools","Feedback processing speed, improvement implementation rate, user satisfaction improvement"
Ops & Reporting,Monitoring,System Monitor,"Monitor AI system health, performance, and availability","System metrics, performance thresholds, alerting rules, monitoring schedules","Monitoring dashboards, alert notifications, health reports, trend analysis","System events, threshold breaches, scheduled monitoring, alert conditions","Monitoring platforms, alerting systems, dashboard tools, log analyzers","System uptime, alert response time, monitoring coverage, false positive rate"
Ops & Reporting,Monitoring,Anomaly Detector,"Detect anomalies in AI system behavior and data patterns","System logs, performance data, behavioral baselines, anomaly thresholds","Anomaly alerts, pattern analysis, root cause investigations, remediation recommendations","Anomaly detection, pattern changes, threshold breaches","Anomaly detection algorithms, pattern analysis tools, ML-based monitors, investigation platforms","Anomaly detection accuracy, false positive rate, investigation speed, resolution time"
Ops & Reporting,Maintenance,Maintenance Scheduler,"Schedule and coordinate maintenance activities for AI systems","Maintenance requirements, system schedules, resource availability, business impact","Maintenance schedules, resource allocations, impact assessments, completion reports","Maintenance needs, scheduled intervals, system issues","Scheduling platforms, resource management, impact analysis, maintenance tracking","Maintenance completion rate, downtime minimization, resource efficiency, schedule adherence"
Ops & Reporting,Maintenance,Update Manager,"Manage updates and patches for AI systems and models","Update requirements, version information, compatibility matrices, rollback procedures","Update plans, deployment schedules, compatibility reports, rollback strategies","Update availability, security patches, compatibility issues","Update management systems, version control, compatibility testing, rollback automation","Update success rate, security patch coverage, compatibility maintenance, rollback frequency"
Ops & Reporting,Reporting & Analytics,Report Generator,"Generate comprehensive reports on AI system performance and business impact","System metrics, business KPIs, reporting templates, stakeholder requirements","Performance reports, business impact analysis, executive dashboards, trend reports","Reporting schedules, ad-hoc requests, milestone achievements","Reporting platforms, data visualization, business intelligence, dashboard tools","Report timeliness, stakeholder satisfaction, insight quality, actionability score"
Ops & Reporting,Reporting & Analytics,Analytics Processor,"Process and analyze data to generate insights and recommendations","System data, business metrics, analytical models, insight requirements","Data insights, trend analysis, predictive analytics, recommendation reports","Data availability, analysis requests, insight generation schedules","Analytics platforms, statistical tools, ML algorithms, visualization tools","Insight accuracy, prediction quality, recommendation adoption rate, analysis completeness"